protokoll_name,protokoll_party,similarity,transcript_start,transcript_end,protokoll_text,transcript_speaker,transcript_text
Martin Hess,AfD,0.9325251945908629,3841.777,4162.81,"Frau Präsidentin! Meine Damen und Herren! Die Haushaltsplanung für den Einzelplan 06 krankt an einem fundamentalen Fehler, und zwar einer völlig verfehlten sicherheitspolitischen Prioritätensetzung. Der Innenminister richtet die Sicherheitspolitik – wie einst die Frau Faeser von der SPD – an der unwahren Behauptung aus, der Rechtsextremismus sei die größte Gefahr für uns alle. Doch wenn dem so wäre, Herr Dobrindt: Warum müssen wir dann unsere christlichen Weihnachtsmärkte und Volksfeste vor Islamisten schützen,  während für öffentliches Fastenbrechen im Ramadan oder sonstige islamische Großveranstaltungen kein Schutz erforderlich ist? Der Bürger unseres Landes kennt die Antwort: Die größte Gefahr geht nicht von rechts, sondern vom Islamismus aus.  Und ein Innenminister, der seinen Job gut macht, muss das endlich auch klar und deutlich benennen.  Wir dürfen den Islamismus und die Islamisierung Deutschlands nicht länger tolerieren. Eine Vielzahl von Terroranschlägen, Aufrufe zum Mord, explodierender Antisemitismus, islamistische Netzwerke in Moscheen und Vereinen, islamistische Drangsalierungen unserer Kinder in unseren Schulen: All das passiert nicht im Ausland, sondern hier, mitten in Deutschland.  Doch von Links-Grün-Rot kommen nur Relativierungen, Leugnung oder Schweigen. Und die Union? Die benennt das Problem zwar, macht aber nahezu nichts dagegen. Deshalb, Herr Minister, mein Appell: Setzen Sie endlich die richtigen Prioritäten, und stoppen Sie diese Staatsfeinde! Und wenn Sie dazu nicht in der Lage oder willens sind, dann machen Sie Platz für die Alternative für Deutschland.  Gleichzeitig wird der Linksextremismus immer stärker; die Antifa marschiert, prügelt und zerstört. Und Linke, Grüne und SPD haben trotzdem keinerlei Skrupel, mit diesen Kriminellen zu sympathisieren, sie zu unterstützen und zu fördern. Lassen Sie sich eines gesagt sein: Antifa ist keine Haltung, wie Sie immer behaupten, und sie ist auch keine zivilgesellschaftliche Bewegung, sondern ein gewalttätiger Mob, der im Internet offen zur Tötung Andersdenkender aufruft und diese mit gnadenloser Gewalt überzieht.  Deshalb sind für jeden überzeugten und aufrechten Demokraten zwei Dinge glasklar:  Erstens. Wer mit der Antifa paktiert, stellt sich gegen unseren Rechtsstaat und hat weder in dieser Regierung noch in diesem Parlament etwas zu suchen.  Und zweitens. Diese linksextremistische Verbrecherorganisation gehört so schnell wie möglich verboten.  Und eine AfD in Regierungsverantwortung wird genau das tun.  Und ich möchte eines noch in aller Deutlichkeit sagen: Was sich hier Teile der Linken in Bezug auf die Ermordung Charlie Kirks, eines 31-jährigen Familienvaters mit zwei Kindern,  der von einem Linksextremisten vor den Augen seiner Familie wegen seiner politischen Überzeugung erschossen wurde, geleistet haben, ist an Niederträchtigkeit und Menschenfeindlichkeit nicht mehr zu überbieten.  Charlie Kirk hat das getan, wovon Sie sich doch schon längst verabschiedet haben:  Er ist in die direkte Debatte mit dem politischen Gegner gegangen; er hat sich dorthin getraut, wo völlig andere politische Meinungen artikuliert worden sind, und hat seinen Standpunkt voller Überzeugung vertreten. Sie und die übrigen Fraktionen in diesem Haus haben sich von dieser urdemokratischen Form der politischen Auseinandersetzung mit dem Bürger doch schon längst verabschiedet.  Sie verweigern sich dieser direkten Debatte, weil Sie wissen, dass die Mehrheit der Bürger Ihren Hirngespinsten nicht mehr folgt.  Und genau deshalb bauen Sie auch politische Brandmauern. Und genau deshalb wollen Sie auch die mittlerweile stärkste Partei in Deutschland verbieten.  Das hat mit Demokratie nichts mehr zu tun.  Das ist die pure Feigheit vor dem besseren Argument. Charlie Kirk war ein besserer Demokrat, als Sie es jemals sein werden.  Und dass die Union sich in zentralen Fragen von diesen Linken abhängig macht, wie heute bei der Richterwahl, zeigt der bürgerlichen Mitte unseres Landes doch eines ganz klar: Die CDU/CSU ist gewissenlos und moralisch bankrott – das sind Sie.  Wir brauchen endlich eine Politik, die klar benennt, wer die wahren Feinde unserer Sicherheit sind,  eine Politik, die nicht beschwichtigt, nicht verharmlost und nicht nur halbherzig reagiert. Islamismus und Linksextremismus müssen endlich mit aller Härte bekämpft und gestoppt werden. Deutschland darf sich nicht länger von diesen Gewaltverbrechern terrorisieren lassen.  Und abschließend ein Appell an die Bürger dieses Landes: Die Zeit des Wegduckens in der Hoffnung, dass schon alles besser werden wird, muss endgültig vorbei sein. Wir sehen doch jeden Tag, was in unseren Städten passiert. Wir sehen doch, dass Deutschland von Tag zu Tag unsicherer wird.  Deshalb dürfen wir nicht mehr schweigen, sondern müssen gemeinsam diese desolaten Zustände immer wieder ansprechen – klar, deutlich und unmissverständlich, –",SPEAKER_19,"Frau Präsidentin! Meine Damen und Herren! Die Haushaltsplanung für den Einzelplan 06 krankt an einem fundamentalen Fehler, und zwar einer völlig verfehlten sicherheitspolitischen Prioritätensetzung. Der Innenminister richtet die Sicherheitspolitik wie einst die Frau Faeser von der SPD an der unwahren Behauptung aus, Rechtsextremismus sei die größte Gefahr für uns alle.  Doch wenn ihm so wäre, Herr Dobrindt, warum müssen wir denn dann unsere christlichen Weihnachtsmärkte und Volksfeste vor Islamisten schützen, aber öffentliches Fastenbrechen im Ramadan oder sonstige islamische Großveranstaltungen? Dort ist kein Schutz erforderlich. Der Bürger unseres Landes kennt die Antwort. Die größte Gefahr geht nicht von rechts, sondern vom Islamismus aus. Und ein Innenminister, der seinen Job gut macht, der muss das auch endlich klar und deutlich benennen.  – Zuruf der Abg. Beatrix von Storch  – Zurufe von der AfD  Gleichzeitig wird der Linksextremismus immer stärker. Die Antifa marschiert, prügelt und zerstört, und Linke, Grüne und SPD haben trotzdem keinerlei Strupel, mit diesen Kriminellen zu sympathisieren, sie zu unterstützen und zu fördern. Lassen Sie sich eines gesagt sein. Antifa ist keine Haltung, wie Sie immer behaupten, und es ist auch keine zivilgesellschaftliche Bewegung, sondern ein gewalttätiger Mob,  der im Internet offen zur Tötung Andersdenkender aufruft und diese mit nadenloser Gewalt überzieht. Deshalb sind für jeden überzeugten und aufrechten Demokraten auch zwei Dinge glasklar. Erstens. Wer mit der Antifa paktiert, stellt sich gegen unseren Rechtsstaat und hat weder in dieser Regierung noch in diesem Parlament etwas zu suchen. Zweitens.  – Zuruf von der AfD  In Bezug auf die Ermordung Charlie Kirks, eines 31-jährigen Familienvaters mit zwei Kindern, der von einem Linksextremisten vor den Augen seiner Familie wegen seiner politischen Überzeugung erschossen wurde, geleistet haben, ist an Niederträchtigkeit und Menschenfeindlichkeit nicht mehr zu überbieten. Charlie Kirk hat das getan.  von dem Sie sich doch schon längst verabschiedet haben. Er ist in die direkte Debatte mit dem politischen Gegner gegangen. Er hat sich dorthin getraut, wo völlig andere politische Meinungen artikuliert worden sind, und hat seinen Standpunkt voller Überzeugung vertreten. Sie und die übrigen Fraktionen in diesem Haus  Sie haben sich von dieser urdemokratischen Form der politischen Auseinandersetzung mit dem Bürger doch schon längst verabschiedet. Sie verweigern sich dieser direkten Debatte, weil Sie wissen, dass die Mehrheit den Bürgern ihren Hirngespinsten nicht mehr folgt.  Und genau deshalb bauen Sie auch politische Brandmauern. Und genau deshalb wollen Sie auch die mittlerweile stärkste Partei in Deutschland verbieten. Das hat mit Demokratie nichts mehr zu tun. Das ist die pure Feigheit vor dem besseren Argument. Charlie Kirk war ein besserer Demokrat, als Sie es jemals sein werden.  Und dass die Union sich in zentralen Fragen von diesen Linken abhängig macht, wie heute diese Richterwahl, zeigt doch der bürgerlichen Mitte unseres Landes eines ganz klar. Die CDU-CSU ist gewissenlos und moralisch bankrott. Das sind sie.  Wir brauchen endlich eine Politik, die klar benennt, wer die wahren Feinde unserer Sicherheit sind. Eine Politik, die nicht beschwichtigt, nicht verharmlost und nicht nur halbherzig reagiert. Islamismus und Linksextremismus müssen endlich mit aller Härte bekämpft und gestoppt werden. Deutschland darf sich nicht länger von diesen Gewaltverbrechern terrorisieren lassen.  Und abschließend ein Appell an die Bürger dieses Landes. Die Zeit des Wegduckens und in der Hoffnung, dass das schon alles besser werden wird, muss endgültig vorbei sein. Wir sehen doch jeden Tag, was in unseren Städten passiert. Wir sehen doch, dass Deutschland von Tag zu Tag unsicher wird. Und deshalb dürfen wir nicht mehr schweigen, sondern müssen gemeinsam diese desolaten Zustände immer wieder ansprechen. Klar, deutlich und unmissverständlich.  – Zuruf von der AfD"
Präsidentin Julia Klöckner,Host,0.9699747708021608,4168.493,4188.628,"Liebe Kollegen, wir sollten uns in einem demokratisch gewählten Parlament nicht gegenseitig die Demokratiefähigkeit absprechen.  Ich darf jetzt das Wort dem Abgeordneten Ingo Vogel für die SPD-Fraktion geben.",SPEAKER_12,"Liebe Kollegen, wir sollten uns in einem demokratisch gewählten Parlament nicht gegenseitig die Demokratiefähigkeit absprechen. Ich darf jetzt das Wort an die SPD-Fraktion an der Reihe mit dem Abgeordneten Ingo Vogel."
Ingo Vogel,SPD,0.9861876125151582,4192.827,4438.497,"Sehr geehrte Frau Präsidentin! Sehr geehrter Herr Minister! Meine sehr geehrten Damen und Herren! Ich versuche mal, wieder ein bisschen was zum Thema zu sagen an der Stelle.  Mit dem vorliegenden Entwurf des Haushaltes für das Jahr 2026 setzen wir als Koalition von CDU, CSU sowie SPD nicht nur auf einen starken Staat, sondern mit dem Einzelplan 06 auch konkret auf eine starke Sicherheitspolitik. In den vorgesehenen rund 9,6 Milliarden Euro für den Bereich der Sicherheit und des Zivil- und Bevölkerungsschutzes stecken insgesamt rund 7,6 Milliarden Euro alleine für polizeiliche Aufgaben und innere Sicherheit. Im Vergleich zum Haushalt 2025 planen wir hier mit einem Plus von 571 Millionen Euro für unter anderem die Bundespolizei, das Bundeskriminalamt, die polizeiliche IT-Infrastruktur sowie insbesondere natürlich auch für mehr Personal. Wir wollen allerdings nicht nur im Bereich der inneren Sicherheit einen finanziellen Ausbau beschließen, sondern diese Finanzierung auch dauerhaft auf ein neues Niveau heben.  Im Vergleich zu den bisherigen Planungen verzeichnet zum Beispiel die Bundespolizei einen Zuwachs von 113 Millionen Euro, aufsteigend auf rund 237 Millionen Euro bis 2029. Und das Bundeskriminalamt stärken wir mit zusätzlich 189 Millionen Euro und erhöhen bis zum Jahr 2029 auf 313 Millionen Euro. Meine Damen und Herren, das ist gut so; denn wir brauchen einen zukunftsfähigen Stabilitätsanker, wenn es um unsere Sicherheit geht. Wir investieren in Personal, in Liegenschaften, in einen modernen polizeilichen Grenzschutz sowie in die Ausstattung und Ausrüstung und natürlich in IT- Infrastruktur. Seit Jahren steigt der Bedarf der Bundespolizei bei Ausrüstung und Personalausstattung, um mit den gestiegenen und neuen Herausforderungen überhaupt umgehen zu können. Deshalb schaffen wir allein für die Bundespolizei 1 000 neue Stellen. Und hierbei möchte ich gerne daran erinnern, dass trotz notwendiger Einsparvorgaben von 2 Prozent bzw. 400 Stellen die Sicherheitsbehörden explizit und aus guten Gründen von dieser Einsparmaßnahme ausgenommen sind.  Das macht deutlich, wie wichtig und erforderlich die Investitionen hier sind. Den größten Personalzuwachs erfahren dabei die Bundesbereitschaftspolizei sowie die Bereiche Strafverfolgung und Ermittlungen. Ganz konkret: Worum geht es? Wofür nehmen wir das Geld in die Hand? Für mehr Personal inklusive Maßnahmen zur Personalgewinnung und Nachwuchswerbung, für Aus- und Fortbildungsmaßnahmen sowie für das Training zur Bewältigung lebensbedrohlicher Einsatzlagen, für moderne Informationstechnik und geeignete Software, für eine aktuelle Ausstattung und Ausrüstung – der Taser ist schon in einer anderen Debatte angesprochen worden –, natürlich für moderne Prävention und zielgenaue Kriminalitätsbekämpfung und nicht zuletzt für erforderliche Fahrzeuge zu Land, zu Wasser und in der Luft. Aufgrund der aktuellen und noch künftigen neuen sicherheitspolitischen Herausforderungen ist es ebenso unerlässlich, das Bundeskriminalamt besser aufzustellen, mit mehr digitaler Souveränität und weniger Bürokratie. Und wichtige Aspekte sind hier: mehr Forschung und Entwicklung – zum Beispiel bei der Drohnenabwehr –, weniger Gefährdungspotenziale aus der Luft, mehr angemessene Ressourcen im Bereich der effektiven Geldwäsche und Finanzkriminalitätsbekämpfung und weniger Schadenspotenzial durch die Auswirkungen auf Betroffene. Das alles zeigt: Wir als Koalition übernehmen Verantwortung. Der Schutz der inneren Sicherheit hat auch im Bundeshaushalt 2026 höchste Priorität.  Lassen Sie mich auch noch den Zoll ganz kurz erwähnen. Der Zoll fällt nicht zielgenau in den Einzelplan 06; aber er ist ebenfalls eine Behörde des Bundes und ein wichtiger Akteur in der deutschen Sicherheitsarchitektur. Auch hier sind Stärkungen unerlässlich. Zum Abschluss möchte ich meinen Dank allen Angehörigen der Sicherheitsbehörden, die tagtäglich ihren Dienst leisten, aussprechen. Herzlichen Dank.",SPEAKER_05,"Sehr geehrte Frau Präsidentin! Sehr geehrter Herr Minister! Meine sehr geehrten Damen und Herren! Ich versuche, mal wieder ein bisschen was zum Thema zu sagen. Mit dem vorliegenden Entwurf des Haushalts für das Jahr 2026 setzen wir als Koalition von CDU, CSU sowie SPD nicht nur auf einen starken Staat, sondern konkret mit dem Einzelplan 06 auch auf eine starke Sicherheitspolitik.  In den vorgesehenen rund 9,6 Milliarden Euro für den Bereich der Sicherheit des Zivil- und Bevölkerungsschutzes stecken insgesamt rund 7,6 Milliarden Euro alleine für polizeiliche Aufgaben und speziell innere Sicherheit.  Im Vergleich zum Haushalt 2025 planen wir hier ein Plus von 571 Millionen Euro für unter anderem die Bundespolizei, das Bundeskriminalamt, die polizeiliche IT-Infrastruktur sowie insbesondere natürlich auch für mehr Personal. Wir wollen allerdings nicht nur im Bereich der inneren Sicherheit einen finanziellen Ausbau beschließen, sondern diese Finanzierung dauerhaft auf ein neues Niveau heben.  Im Vergleich zu den bisherigen Planungen verzeichnet zum Beispiel die Bundespolizei einen Zuwachs von 113 Millionen Euro aufsteigend auf rund 237 Millionen Euro bis 2029, und das Bundeskriminalamt stärken wir mit zusätzlich 189 Millionen Euro und erhöhen bis zum Jahr 2029 auf 313 Millionen Euro. Meine Damen und Herren, das ist gut so, denn wir brauchen einen zukunftsfähigen Stabilitätsanker, wenn es um unsere Sicherheit geht.  Wir investieren in Personal, in Liegenschaften, in einen modernen polizeilichen Grenzschutz sowie in die Ausstattung und Ausrüstung und natürlich in IT-Infrastruktur. Seit Jahren steigt der Bedarf der Bundespolizei bei Ausrüstung und Personalausstattung, um überhaupt mit den gestiegenen und neuen Herausforderungen umgehen zu können. Deshalb schaffen wir auch allein für die Bundespolizei über 1 000 neue Stellen. Hierbei möchte ich gerne daran erinnern,  dass trotz notwendiger Einsparvorgaben von 2 Prozent bzw. 400 Stellen die Sicherheitsbehörden explizit und aus gutem Gründen von dieser Einsparmaßnahme ausgenommen sind.  Das macht deutlich, wie wichtig und erforderlich die Investitionen hier sind. Den größten Personalzuwachs erfahren dabei die Bundesbereitschaftspolizei sowie die Bereiche Strafverfolgung und Ermittlung. Ganz konkret, worum geht es, wofür nehmen wir das Geld in die Hand? Für mehr Personal inklusive Maßnahmen zur Personalgewinnung und Nachwuchswerbung.  Aus- und Fortbildungsmaßnahmen sowie Trainings zur Bewältigung lebensbedrohlicher Einsatzlagen und natürlich für moderne IT-Technik und geeignete Software, für eine aktuelle Ausstattung und Ausrüstung der Tesa ist schon in einer anderen Debatte angesprochen worden und natürlich für moderne Prävention und zielgenaue Kriminalitätsbekämpfung und nicht zuletzt für erforderliche Fahrzeuge zu Land, zu Wasser und in der Luft.  Aufgrund der aktuellen und noch künftigen neuen sicherheitspolitischen Herausforderungen ist es ebenso unerlässlich, das Bundeskriminalamt besser aufzustellen, mit mehr digitaler Souveränität und weniger Bürokratie. Wichtig sind hier mehr Forschung und Entwicklung, zum Beispiel in der Drohnenabwehr, weniger Gefährdungspotenziale aus der Luft, mehr angemessene Ressourcen im Bereich der effektiven Geldwäsche und Finanzkriminalitätsbekämpfung und weniger Schadenspotenzial durch die Auswirkungen auf Betroffene.  Und das alles zeigt, wir übernehmen Verantwortung als Koalition. Der Schutz der inneren Sicherheit hat auch im Bundeshaushalt 2026 höchste Priorität.  Lassen Sie mich zum Schluss auch noch den Zoll ganz kurz erwähnen. Der Zoll fällt nicht zielgenau in den Einzelplan 06, aber er ist ebenfalls eine Behörde des Bundes und ein wichtiger Akteur in der deutschen Sicherheitsarchitektur. Auch hier sind Stärkungen unerlässlich. Zum Abschluss möchte ich meinen Dank an allen Angehörigen wenden, die den Sicherheitsbehörden tagtäglich ihren Dienst leisten. Herzlichen Dank."
Präsidentin Julia Klöckner,Host,0.37688001347321615,4446.121,4451.203,Für die Fraktion der AfD hat der Abgeordnete Martin Hess das Wort.,SPEAKER_12,Für die Fraktion Bündnis 90 Die Grünen hat Frau Abgeordnete Marlene Schönberger das Wort.
Präsidentin Julia Klöckner,Host,0.9597811805030612,4456.82,4636.184,"Für die Fraktion Bündnis 90/Die Grünen hat Frau Abgeordnete Marlene Schönberger das Wort.  Marlene Schönberger : Sehr geehrte Frau Präsidentin! Liebe Kolleginnen und Kollegen! Während Männlichkeits-Influencer mit frauenverachtenden Inhalten Millionen Menschen erreichen, rechtsextreme Jugendgruppen Terrorpläne schmieden und der Kreml, wie er selbst sagt, eine Schlacht um die Köpfe und Herzen der Menschen führt – übrigens mit Unterstützung seiner begeisterten Helfer/-innen –, streicht der Innenminister nicht nur massiv Gelder bei der Bekämpfung ausländischer Desinformationskampagnen; sondern spart auch bei politisch-historischer Bildung. Dass Sie, Herr Dobrindt, sämtliche Ihrer Behörden mit einem massiven Aufwuchs versehen, außer der Bundeszentrale für politische Bildung, ist unverantwortlich.  Und völlig unverständlich ist, dass, während bei politischer Bildung gespart wird, der Verein Republik21 eine institutionelle Förderung bekommt – ein Verein, in dem davon schwadroniert wird, dass kleine woke Eliten die Strippen ziehen, Kultur und Medien dominieren;  ein Verein, der mit dem dubiosen ÖRR-Blog kooperiert, dessen täglich Brot nichts anderes ist als rechtspopulistische Medienschelte.  Wenn sich die Indizien verdichten, dass ein Teil der Union die Methoden von Trump bewundert, frage ich Sie, liebe Kolleginnen und Kollegen von der SPD: Wo bleibt eigentlich Ihr Widerspruch?  Liebe Kolleginnen und Kollegen, dass wir über solche Sachen hitzig diskutieren, ist wichtig – das macht Demokratie aus. Dass wir uns beim Kampf gegen den Antisemitismus aber sehr häufig bei sehr vielem sehr einig sind, das ist essenziell. In den letzten Tagen wurden Spieler von Makkabi Köln antisemitisch beleidigt, bespuckt, gewürgt, geschlagen.  „JUDEN haben hier Hausverbot“ – so ein Schild wurde in Flensburg aufgehängt.  Und das sind nur zwei Beispiele aus den letzten Tagen. Antisemitismus war immer da: rechts, links, in der Mitte der Gesellschaft.  Aber seit dem 7. Oktober stehen bei OFEK die Telefone nicht mehr still. OFEK hilft bei antisemitischen Vorfällen. Der Verein bietet psychosoziale Unterstützung bei antisemitischen Vorfällen, Krisenintervention, berät Schulen, Hochschulen, Museen und Unternehmen. Liebe Kolleginnen und Kollegen der Union, liebe Kolleginnen und Kollegen der SPD, gemeinsam haben wir uns in einer Resolution verpflichtet, jeden Antisemitismus zu bekämpfen. Was es jetzt braucht, ist die konkrete Unterstützung der Betroffenen,  auch für die, die ihnen zur Seite stehen.  Deshalb bitte ich Sie, liebe Kolleginnen und Kollegen: Sorgen wir jetzt gemeinsam für die langfristige finanzielle Absicherung von OFEK, denen es gerade gelingt, Jüdinnen und Juden zu begleiten, ihnen Hoffnung zu geben in einer Situation, in der alles düster erscheint. Gehen wir den Weg gemeinsam! Vielen Dank.",SPEAKER_00,"Sehr geehrte Frau Präsidentin! Liebe Kolleginnen! Während Männlichkeitsinfluencer mit frauenverachtenden Inhalten Millionen erreichen, rechtsextreme Jugendgruppen Terrorpläne schmieden und der Kreml, wie er selbst sagt, eine Schlacht um die Köpfe und Herzen der Menschen führt übrigens mit Unterstützung seiner begeisterten Helferinnen und Helfer streicht der Innenminister nicht nur massiv Gelder bei der Bekämpfung ausländischer Desinformation, auch bei politisch-historischer Bildung wird gespart.  dass Sie, Herr Dobrindt, sämtliche Ihrer Behörden mit einem massiven Aufwuchs versehen, außer die Bundeszentrale für politische Bildung. Das ist unverantwortlich.  Völlig unverständlich ist, dass während bei politischer Bildung gespart wird, der Verein Republik 21 eine institutionelle Förderung bekommt, ein Verein, bei dem davon schwadroniert wird, dass kleine, woke Eliten die Strippen ziehen, Kultur und Medien dominieren, ein Verein, der mit dem dubiosen ÖRR-Blog kooperiert, dessen täglich Brot nichts anderes ist als rechtspopulistische Medienschelte.  Wenn sich die Indizien verdichten, dass ein Teil der Union die Methoden von Trump bewundert, frage ich Sie, liebe Kolleginnen von der SPD, wo bleibt eigentlich Ihr Widerspruch?  Liebe Kolleginnen, dass wir über solche Sachen hitzig diskutieren, ist wichtig, weil das macht Demokratie aus. Dass wir beim Kampf gegen den Antisemitismus aber sehr häufig bei sehr vielem sehr einig sind, das ist essentiell. In den letzten Tagen wurden Spieler von Maccabi Köln antisemitisch beleidigt, bespuckt, gewürgt, geschlagen.  Juden haben hier Hausverbot. So ein Schild wurde in Flensburg aufgehängt. Das sind nur zwei Beispiele aus den letzten Tagen. Antisemitismus war immer da, rechts, links, in der Mitte der Gesellschaft. Aber seit dem 7. Oktober stehen bei Ofek die Telefone nicht mehr still.  Offek hilft bei antisemitischen Vorfällen. Der Verein bietet Unterstützung bei antisemitischen Vorfällen, bietet psychosoziale Unterstützung, Krisenintervention, berät Schulen, Hochschulen, Museen und Unternehmen.  Liebe Kolleginnen der Union, liebe Kolleginnen der SPD, gemeinsam haben wir uns in einer Resolution verpflichtet, jeden Antisemitismus zu bekämpfen. Und was es jetzt braucht, ist die konkrete Unterstützung der Betroffenen und auch für die, die Ihnen zur Seite stehen.  Deshalb bitte ich Sie, liebe Kolleginnen und Kollegen, sorgen wir jetzt gemeinsam für die langfristige finanzielle Absicherung von Ofek, denen es gerade gelingt, Jüdinnen und Juden zu begleiten, ihnen Hoffnung zu geben in einer Situation, in der alles düster erscheint. Gehen wir den Weg gemeinsam!"
Präsidentin Julia Klöckner,Host,0.8196206227795532,4644.352,4649.097,Das Wort hat nun der fraktionslose Kollege Herr Stefan Seidler.,SPEAKER_12,Vielen Dank. Das Wort hat nun der fraktionslose Kollege Herr Stephan Seidler.
