protokoll_name,protokoll_party,similarity,transcript_start,transcript_end,protokoll_text,transcript_speaker,transcript_text
Vizepräsidentin Andrea Lindholz,Host,0.29160858013965474,0.031,24.097,"Weitere Wortmeldungen zu diesem Einzelplan liegen nicht vor. Damit schließen wir die Beratungen zu diesem Punkt. Wir kommen jetzt zum nächsten Geschäftsbereich, und zwar zum Geschäftsbereich des Bundesministeriums für Forschung, Technologie und Raumfahrt, Einzelplan 30. – Liebe Kolleginnen und Kollegen, ich bitte Sie, die Plätze einzunehmen. Wir setzen dann unsere Aussprache fort und beginnen in dieser Debatte jetzt mit der Kollegin Ronja Kemmer für die Unionsfraktion.",SPEAKER_12,von insgesamt neun Stunden vereinbart. Wir kommen zu dem Geschäftsbereich des Bundesministeriums des Innern. Das Wort hat nun für die Bundesregierung der Bundesminister des Innern Alexander Dobrindt.
Präsidentin Julia Klöckner,Host,0.8772713392400115,24.697,629.978,"Guten Morgen zusammen! Ich eröffne hiermit die Sitzung. Liebe Kolleginnen und Kollegen, wir sind ein Parlament, in dem man mit Worten, mit Argumenten streitet. Wir leben glücklicherweise in einem Land, in dem das freie Wort gilt, und Parlamentarier werden eben nicht verfolgt für ihr Wort, für das freie Wort, das sie sagen. Deshalb sind Demonstrationen im Plenarsaal nicht nur unangebracht, sondern aus gutem Grund hier auch untersagt. Das sind Regeln, die wir uns in diesem Hohen Haus selbst gegeben haben, und das gilt sowohl für die Besuchertribüne als auch für den Abgeordnetensaal hier, selbst für uns. Gestern wurde von einigen Abgeordneten der Linksfraktion hier eine Fahne gehisst. Meine Kollegin Vizepräsidentin Josephine Ortleb hat zu Recht für diesen Tag die Abgeordneten von der Sitzung ausgeschlossen. Ich kündige hiermit an, dass wir bei weiterer Zuwiderhandlung einen längeren Sitzungsausschluss vorsehen oder auch Ordnungsgelder. Wenn man nicht mehr an die Kraft der eigenen Worte, der eigenen Argumente glaubt und Demonstrationen im Plenarsaal vollführt, dann setzt man sich auch dem Vorwurf aus, diesen Saal hier, das Plenum, nicht mehr ernst zu nehmen, sondern zu missbrauchen, für die eigenen digitalen Kanäle.  Deshalb sage ich sehr klar: Ganz gleich – wirklich ganz gleich –, welche Fraktion so etwas vorhat, macht oder gemacht hat, nicht der Absender und auch nicht das Anliegen sind entscheidend, sondern die aus gutem Grund selbstgesetzten Regeln. Ich möchte deshalb noch einmal daran erinnern, bevor wir dann auch mit der Debatte beginnen: Uns schauen diejenigen zu, die uns gewählt haben, die Steuerzahler, die unser Gehalt zahlen, uns schauen junge Menschen zu. Wir haben eine Vorbildfunktion in diesem Haus. Die Bevölkerung kann von uns zu Recht erwarten, dass wir das Wort im Hohen Haus ernst nehmen und es auch mit Leben füllen. Wer Plakate, Fahnen und Rufe braucht, wer damit demonstrieren will, der kann das auf der Straße tun; auch das ermöglicht unsere Demokratie. Meine Aufgabe und mein Wille als Bundestagspräsidentin ist es, auf die Regularien, auf die Würde dieses Hauses zu achten. Kein noch so vermeintlich hoher moralischer Anspruch rechtfertigt es, diese Regeln nicht zu beachten. Ich bitte darum, dass das alle hier beachten; denn es schauen uns andere zu, und wir sind Abgeordnete für das deutsche Volk und nicht für uns selbst und unsere digitalen Medien.  Bevor wir in die Tagesordnung eintreten, haben wir noch eine Wahl durchzuführen. Als Schriftführer soll auf Vorschlag der Fraktion der CDU/CSU der Abgeordnete Oliver Pöpsel als Nachfolger für den Abgeordneten Michael Hose gewählt werden. Sind Sie damit einverstanden? – Ich sehe, das ist der Fall. Damit ist der Kollege Oliver Pöpsel gewählt. Ich bedanke mich im Übrigen an dieser Stelle sehr bei den Schriftführerinnen und Schriftführern aus allen Fraktionen. Wir setzen unsere Haushaltsberatungen – Tagesordnungspunkt 1 – fort: a) Erste Beratung des von der Bundesregierung eingebrachten Entwurfs eines Gesetzes über die Feststellung des Bundeshaushaltsplans für das Haushaltsjahr 2026  Drucksache 21/600 Überweisungsvorschlag: Haushaltsausschuss b) Beratung der Unterrichtung durch die Bundesregierung Finanzplan des Bundes 2025 bis 2029 Drucksache 21/601 Überweisungsvorschlag: Haushaltsausschuss Für die heutige Aussprache haben wir eine Redezeit von insgesamt neun Stunden vereinbart. Wir kommen zum Geschäftsbereich des Bundesministeriums des Innern, Einzelplan 06. Das Wort hat nun für die Bundesregierung der Bundesminister des Innern, Alexander Dobrindt.  Alexander Dobrindt, Bundesminister des Innern: Sehr geehrte Damen und Herren! Liebe Kolleginnen und Kollegen! Frau Präsidentin! Der Haushalt 2026 – er ist ein Meilenstein für die Sicherheitspolitik in Deutschland. Wir stärken die Polizei, wir schützen durch den Ausbau der Zivilverteidigung, wir werden schlagkräftiger durch den Ausbau der Drohnenabwehr. Genau das ist der Maßstab der Politik der neuen inneren Sicherheit: Stärke, Schutz und Schlagkraft. Das ist das, was diese Koalition umsetzt.  Die heutige Bedrohungslage, meine Damen und Herren, sie ist abstrakt und hoch, ja, und sie ist im Einzelfall natürlich auch konkret. Auch heute Nacht hat es wieder Drohnenüberflüge über kritische Infrastruktur in Dänemark gegeben. Wir sind Ziel hybrider Bedrohungen, wir sind Ziel von Sabotage und Spionage. Deswegen rüsten wir gegen diese hybriden Bedrohungen auf. Zeitenwende heißt nicht nur Ausbau militärischer Verteidigung, Zeitenwende heißt Aufrüsten bei der inneren Sicherheit. Wir befinden uns in einem Wettrüsten zwischen Drohnenbedrohung und Drohnenabwehr. Deswegen werden wir stärker in dieses Wettrüsten investieren, sowohl mit Mitteln der Gestaltung eines neuen Luftsicherheitsgesetzes als auch mit finanziellen Mitteln, und nach dem Grundsatz „aufspüren, abwehren, abfangen“. Das ist der Maßstab, wie wir mit der Drohnenbedrohung umgehen.  Und die Aggression geht dabei auch von Russland aus. Das erleben wir jeden Tag. Luftraumverletzungen bei unseren europäischen Nachbarn, Drohnenüberflüge, Cyberangriffe, wir erleben das jeden Tag. Dabei kann man sich nur wundern, dass es immer wieder Versuche gibt, diese Bedrohung gerade aus Russland kleinzureden. Diese Bedrohung ist allgegenwärtig. Umso unverständlicher ist es, wenn beispielsweise der Parteivorsitzende der AfD sich im Sommerinterview in den Medien äußert und sagt: Feindliche Absichten von Russland bezogen auf Deutschland sehe ich nicht. – Meine Damen und Herren, ich sehe die sehr wohl. Es sind offensichtlich nicht nur die militärischen Drohnen am Himmel, sondern auch die ideologischen Drohnen im Parlament, die unsere Sicherheit infrage stellen.  Wir werden bei unseren Behörden neue Befugnisse schaffen gegen jede Form des Extremismus. Wir werden neue Befugnisse schaffen digitaler Art: Einsatz von KI und auch die Quellen-TKÜ. Wir haben hier jahrelang über diesen Einsatz diskutiert und auch gestritten. Vor wenigen Tagen hat es in Teilen Berlins wieder einen Blackout gegeben, weil Linksextremisten zwei Stromverteiler in Brand gesetzt haben. Das war gezielt ausgewählt. Das war kein Versehen. Das war eine gezielte Attacke gegen unsere Gesellschaft. In einem Bekennerschreiben haben diese Linksextremisten formuliert, dass sich ihre Taten gegen den militärischindustriellen Komplex richten würden. Meine Damen und Herren, wir kennen alle diese Wortwahl aus vergangenen Zeiten. Die extremistische Bedrohung auch durch den Linksextremismus, sie ist wieder sehr konkret in Deutschland. Dabei hat dieser Linksextremismus dann auch noch Tausende von Bürgern in Mitleidenschaft gezogen, wie wir das aus der Vergangenheit kennen: 20 000 Haushalte ohne Strom, Tausende ohne Wärme. Das wird in einem Bekennerschreiben dann banal als „Kollateralschaden“ bezeichnet. Meine Damen und Herren, wer mit Sachbeschädigung, Straßenterror, Staatsverachtung durch dieses Land zieht, wer Anarchie statt Argumente predigt, der hat die volle Härte des Gesetzes und des Staates verdient. Deswegen werden wir gegen diese Linksextremisten vorgehen.  Gestern hat mir die Fraktionsvorsitzende der Grünen hier im Parlament in ihrer Rede vorgeworfen, ich hätte die Grünen in Richtung von Kriminellen gestellt und gesagt, Grüne stünden auf der Seite von Kriminellen.  Noch mal zur Klarstellung: Es war der innenpolitische Sprecher der Grünen, der mir vorgeworfen hat, ich würde mich zum Handlanger der Taliban machen, weil ich Straftäter nach Afghanistan abschiebe.  Deswegen zur Wiederholung meine Worte in meiner letzten Rede: „Wer nach Afghanistan Straftäter abschiebt, der macht sich nicht zum Handlanger der Taliban. Aber wer diese Abschiebungen nach Afghanistan verhindern will, der macht sich vielleicht zum Handlanger für Straftäter […].“ Und das ist richtig, meine Damen und Herren.  Dann haben Sie, verehrte Kollegen von den Grünen, kritisiert, dass ich Gespräche vorbereite,  nicht nur in Doha, in Katar, sondern auch in Kabul für Rückführungen von Straftätern.  Ich bereite diese Gespräche deswegen vor, weil ich regelmäßig Straftäter nach Afghanistan abschieben will, nicht nur mit Charterflügen, sondern auch mit Linienflügen. Ich will, dass das regelmäßig möglich ist. Dazu braucht es auch Gespräche in Kabul. Und ich habe jetzt mal nachgeschaut: Wie war denn das in der letzten Wahlperiode? Das grüne Außenministerium unter Annalena Baerbock: Sie haben sechsmal Gespräche in Kabul mit der De-facto- Regierung in Afghanistan geführt. Wie heuchlerisch ist das denn, was Sie hier aufführen, meine Damen und Herren?  Ja, genau so heuchlerisch ist das! Meine Damen und Herren, wir wollen in der Europäischen Union ein gemeinsames Asylsystem, wir wollen einen funktionsfähigen Migrationspakt. Da gibt es eine große Übereinstimmung mit unseren europäischen Nachbarn. Nicht nur Deutschland profitiert vom Rückgang der illegalen Migration, ganz Europa profitiert vom Rückgang der illegalen Migration nach Deutschland. Und deswegen gehen wir diesen Weg konsequent weiter. Deutschland hat wieder eine Führungsrolle in Europa beim Kampf gegen die illegale Migration. Und deswegen habe ich meine Kolleginnen und Kollegen Innenminister unserer Nachbarländer jetzt erneut, am 4. Oktober, nach München eingeladen: zur Schärfung und Härtung von GEAS.  Wir werden genau über diese Situation verhandeln: Wie können wir in die gemeinsame europäische Asylpolitik mehr Schärfe und mehr Härte bringen? Da geht es auch um innovative Lösungen. Wir haben heute lesen können, dass unsere Nachbarn, die Niederländer, gerade innovative Lösungen vorbereiten: Rückkehrzentren in Drittstaaten wie Uganda. Meine Damen und Herren, auch das ist ein notwendiger Weg, um unser Asylsystem zu stärken und zu härten, indem wir Vereinbarungen mit Drittstaaten organisieren, weil wir in Europa schlichtweg nicht akzeptieren wollen, dass kriminelle Banden, dass Schleuser, Schlepper und Menschenhändler darüber entscheiden, wer nach Europa kommt. Das muss die Politik entscheiden und nicht die kriminellen Banden.  Genau zu diesem Treffen werden wir auch wieder die neuen Zahlen präsentieren, und wir werden sie aus Deutschland und in Europa präsentieren. Und ich kann Ihnen heute schon sagen: Nicht nur die Zahlen der illegalen Migration vom August gehen gegenüber dem Vorjahr um 60 Prozent runter, auch die Zahlen vom September dieses Jahres werden um 60 Prozent niedriger sein als vor einem Jahr, weil wir die Pullfaktoren reduzieren,  den Familiennachzug aussetzen, die Turboeinbürgerung abschaffen, weil wir die Dauer der Grenzkontrollen verlängern. 15 000 Zurückweisungen an den Grenzen seit Beginn dieser Koalition, 4 000 Menschen mit Haftbefehl an der Grenze aufgegriffen, 750 Schleuser festgenommen: Das ist die Bilanz dieser Regierung in den ersten Monaten.  So machen wir weiter, und so bringen wir Deutschland voran. Herzlichen Dank.",SPEAKER_07,"Sehr geehrte Damen und Herren! Liebe Kolleginnen und Kollegen! Frau Präsidentin!  Der Haushalt 2026 ist ein Meilenstein für die Sicherheitspolitik in Deutschland. Wir stärken die Polizei, wir schützen durch den Ausbau der Zivilverteidigung, wir werden schlagkräftiger durch den Ausbau der Drohnenabwehr. Genau das ist der Maßstab der Politik der neuen inneren Sicherheit. Stärke, Schutz und Schlagkraft, das ist das, was diese Koalition umsetzt.  Die heutige Bedrohungslage, meine Damen und Herren, sie ist abstrakt und hoch, ja, und sie ist im Einzelfall natürlich auch konkret. Auch heute Nacht hat es wieder Drohnenüberflüge gegeben über kritische Infrastruktur in Dänemark.  Wir sind Ziel einer hybriden Bedrohung. Wir sind Ziel von Sabotage und Spionage, und deswegen rüsten wir gegen diese hybriden Bedrohungen auf. Zeitenwende heißt nicht nur Ausbau militärischer Verteidigung. Zeitenwende heißt Aufrüsten bei der inneren Sicherheit. Wir befinden uns in einem Wettrüsten zwischen Drohnenbedrohung und Drohnenabbruch.  Deswegen werden wir stärker in dieses Wettrüsten investieren, sowohl mit Mitteln der neuen Gestaltung eines Luftsicherheitsgesetzes als auch mit finanziellen Mitteln nach dem Grundsatz aufspüren, abwehren, abfangen. Das ist der Maßstab, wie man mit der Drohnenbedrohung umgeht. Die Aggressionen  Sie geht dabei auch von Russland aus. Das erleben wir jeden Tag Luftraumverletzungen bei unseren europäischen Nachbarn.  Drohnenüberflüge, Cyberangriffe. Wir erleben das jeden Tag. Dabei kann man sich nur wundern, dass es immer wieder Versuche gibt, auch diese Bedrohung gerade aus Russland kleinzureden. Diese Bedrohung, sie ist allgegenwärtig. Und so unverständlicher ist es, wenn beispielsweise der Parteivorsitzende  der AfD sich im Sommerinterview in den Medien äußert und sagt, feindliche Absichten von Russland bezogen auf Deutschland sehe ich nicht. Meine Damen und Herren, ich sehe die sehr wohl. Es sind offensichtlich nicht nur die militärischen Drohnen am Himmel, sondern auch die ideologischen Drohnen im Parlament, die unsere Sicherheit infrage stellen.  Wir werden bei unseren Behörden neue Befugnisse schaffen gegen jede Form des Extremismus. Wir werden neue Befugnisse schaffen digitaler Art,  Einsatz von KI und auch die Quellen-TKÜ. Wir haben jahrelang hier über diesen Einsatz diskutiert und auch gestritten. Vor wenigen Tagen, meine Damen und Herren, hat es in Teilen Berlins wieder einen Blackout gegeben, weil Linksextremisten zwei Stromverteiler in Brand gesetzt haben. Das war gezielt ausgewählt. Das war kein Versehen. Das war eine  gezielte Attacke gegen unsere Gesellschaft. In einem Bekennerschreiben haben diese Linksextremisten formuliert, dass sich ihre Taten gegen den militärisch-industriellen Komplex richten würden.  – Zuruf des Abg. Dr. Bernd Baumann  Tausende von Bürgern in Mitleidenschaft gezogen, wie wir das aus der Vergangenheit kennen. 20 000 Haushalte ohne Strom, Tausende ohne Wärme. Und das wird in einem Bekennerschreiben dann banal als Kollateralschaden bezeichnet.  Meine Damen und Herren, wer mit Sachbeschädigung, Straßenterror, Staatsverachtung durch dieses Land zieht, wer Anarchie statt Argumente predigt, der hat die volle Härte des Gesetzes und des Staates verdient. Deswegen werden wir gegen diese Linksextremisten vorgehen.  Gestern hat mir die Fraktionsvorsitzende der Grünen hier im Parlament in ihrer Rede vorgeworfen, ich hätte die Grünen in Richtung von Kriminellen gestellt und gesagt, Grüne stünden auf der Seite von Kriminellen.  Nur noch mal zur Klarstellung, meine Damen und Herren. Es war der innenpolitische Sprecher der Grünen, der mir vorgeworfen hat, ich würde mich zum Handlanger der Taliban machen, weil ich Straftäter nach Afghanistan abschiebe.  Meine Damen und Herren, deswegen auch noch mal zur Wiederholung hier meine Worte von meiner letzten Rede. Sie waren, wer nach Afghanistan Straftäter abschiebt, der macht sich nicht zum Handlanger der Taliban. Aber wer diese Abschiebungen nach Afghanistan verhindern will, der macht sie vielleicht zum Handlanger der Straftäter. Und das ist richtig, meine Damen und Herren.  Dann haben Sie übrigens, verehrte Kollegen von den Grünen, kritisiert, dass ich Gespräche vorbereite, nicht nur in Doha, in Katar, sondern dass ich Gespräche vorbereite für Rückführung von Straftätern auch in Kabul.  Ich bereite diese Gespräche deswegen vor, weil ich regelmäßig Straftäter nach Afghanistan abschieben will, nicht nur mit Charterflügen, sondern auch mit Linienflügen. Ich will, dass das regelmäßig möglich ist. Dazu braucht es auch Gespräche  in Kabul. Ich habe jetzt mal nachgeschaut, meine Damen und Herren, wie das in der letzten Wahlperiode war, das grüne Außenministerium unter Annalena Baerbock. Sie haben sechsmal Gespräche in Kabul mit der de facto Regierung in Afghanistan geführt. Wie heuchlerisch ist das denn, was Sie hier aufführen, meine Damen und Herren?  Ja, genau so heuchlerisch ist das.  Meine Damen und Herren, wir wollen in der Europäischen Union ein gemeinsames Asylsystem. Wir wollen einen funktionsfähigen Migrationspakt. Da gibt es eine große Übereinstimmung mit unseren europäischen Nachbarn. Nicht nur Deutschland profitiert vom Rückgang der illegalen Migration. Ganz Europa profitiert vom Rückgang der illegalen Migration nach Deutschland. Deswegen gehen wir diesen Weg konsequent weiter. Deutschland hat wieder eine Führungsrolle in Europa beim Kampf  gegen die illegale Migration. Deswegen habe ich meine Kolleginnen und Kollegen Innenminister unserer Nachbarländer eingeladen, jetzt auch erneut am 4. Oktober nach München zur Schärfung und Härtung von GEAS. Wir werden genau über diese Situation verhandeln. Wie können wir in die gemeinsame europäische Asylpolitik  mehr Schärfe und mehr Härte bringen. Da geht es auch um innovative Lösungen. Wir haben heute lesen können, dass unsere Nachbarn, die Niederländer, innovative Lösungen gerade vorbereiten, Rückkehrzentren in Drittstaaten mit Uganda. Meine Damen und Herren, auch das ist schlichtweg ein notwendiger Weg,  unser Asylsystem zu stärken und zu härten, indem wir Vereinbarungen mit Drittstaaten organisieren, weil wir schlichtweg in Europa nicht akzeptieren wollen, dass kriminelle Banden, dass Schleuserschlepper, Menschenhändler darüber entscheiden, wer nach Europa kommt. Es muss die Politik entscheiden und nicht die kriminellen Banden.  Genau zu diesen Treffen werden wir auch wieder die neuen Zahlen präsentieren. Wir werden sie aus Deutschland heraus und in Europa präsentieren. Ich kann Ihnen heute schon sagen, dass nicht nur die Zahlen im August  gehen um 60 Prozent runter bei der illegalen Migration gegenüber dem Vorjahr. Auch die Zahlen im September dieses Jahres werden um 60 Prozent weniger sein als vor einem Jahr, weil wir die Pull-Faktoren reduzieren, Familiennachzug aussetzen, Turboeinbürgerung abschaffen, weil wir die Grenzkontrollen auch verlängern.  15 000 Zurückweisungen an den Grenzen seit Beginn dieser Koalition, übrigens 4 000 Menschen mit Haftbefehl an der Grenze aufgegriffen, 750 Schleuser festgenommen. Das ist die Bilanz dieser Regierung in den ersten Monaten. So machen wir weiter, und so bringen wir Deutschland voran. Herzlichen Dank."
Präsidentin Julia Klöckner,Host,1.0000000000000002,644.521,649.688,Für die Fraktion der AfD hat Herr Abgeordneter Dr. Gottfried Curio das Wort.,SPEAKER_12,Für die Fraktion der AfD hat Herr Abgeordneter Dr. Gottfried Curio das Wort.
