protokoll_name,protokoll_party,similarity,transcript_start,transcript_end,protokoll_text,transcript_speaker,transcript_text
Leon Eckert,BÜNDNIS 90/DIE GRÜNEN,0.9514099944495038,1333.24,1646.055,"Sehr geehrte Frau Präsidentin! Sehr geehrte Kolleginnen und Kollegen! Liebe Bürgerinnen und Bürger! Sehr geehrter Herr Bundesminister Dobrindt! Das 2022 beschlossene Sondervermögen für die Bundeswehr war notwendig und gleichzeitig, zeigt eine Rückschau, kurzsichtig. Denn es reduzierte die Bedrohung Russlands auf eine rein militärisch zu begegnende Gefahr. Diese Kurzsichtigkeit konnte 2025 mit der Bereichsausnahme für die zivile Verteidigung, die von uns Grünen eingebracht worden ist, behoben werden. Doch wir müssen kritisch sagen: Damit haben wir im Bereich des Bundesinnenministeriums drei Jahre trotz proklamierter Zeitenwende weiter gesnoozt. Maßgeblich für diese Kurzsichtigkeit waren Herr Merz und die Union, die 2022 als Verhandlungsbedingung für das Sondervermögen formuliert haben, diese solle – Zitat – „ausschließlich der Aufrüstung der Bundeswehr zugutekommen […]“. Uns Grünen war bewusst, dass diese Bereichsausnahme und die damit einhergehende Mittelerhöhung nicht von uns selbst im Ministerium verwaltet wird, und dennoch haben wir diese Mittel ermöglicht; denn die Bedrohungslage für Deutschland ist hoch – so hoch, dass Handeln erforderlich ist. Und auch wenn dies jetzt jemand umsetzt, dessen Überzeugungen wir nicht in jedem Themenfeld der Innenpolitik teilen, haben wir doch aus Überzeugung dieser Bereichsausnahme zugestimmt. Herr Dobrindt, dass Sie natürlich das Thema so monothematisch bearbeiten, wie jetzt auch in Ihrer Rede gezeigt, und als Feigenblatt die Bedrohung eigentlich nur am Anfang einmal ansprechen, um nur über Migration zu sprechen, das hat uns vielleicht überrascht. Aber der Einzelplan des Bundesinnenministeriums 2026 bildet jetzt die Zeitenwende, die wir eigentlich schon 2022 im Zivilschutz hätten vollziehen müssen, ab. Mit starken Aufwüchsen in allen Bereichen der zivilen Verteidigung ist die finanzielle Grundlage gelegt, die neue Sicherheitslage in Europa ergänzend zum Etat des Verteidigungsministeriums jetzt richtig aufzustellen. Das ist auch dringend notwendig; denn in der Gesamtverteidigung nimmt das Bundesinnenministerium eine zentrale Rolle ein, und zwar, den Schutz der Bevölkerung an erste Stelle zu stellen und im Zweifelsfall bei Ressourcenkonflikten, die zwischen militärischer Logik und Zivilschutzlogik entstehen, im Sinne der Bevölkerung und des Schutzes der Bevölkerung vor Kriegsauswirkungen zu entscheiden. Wird diese Lücke nicht selbstbewusst wahrgenommen, dann verfehlt diese Aufgabenteilung zwischen Innenressort und Verteidigungsressort seine Wirkung. Dann könnte man auch den Zivilschutz an den militärischen Bereich anhängen, so wie das in vielen anderen europäischen Staaten ist. Doch jetzt, wo so viel Geld da ist, braucht es nicht nur Mittel, sondern eben auch neue rechtliche Grundlagen, um der Bedrohungslage wirklich effektiv zu begegnen. Die Drohnen wurden bereits angesprochen. Die Ausrüstung kann jetzt beschafft werden. Aber jetzt brauchen wir eben auch zügig die gesetzliche Grundlage, um diese Drohnenabwehr zu organisieren.  Während sich in Schweden über 100 Mitarbeiterinnen und Mitarbeiter um das Erkennen und Aufdecken ausländischer Desinformation kümmern, bleibt unsere Zentrale Stelle zur Erkennung ausländischer Informationsmanipulation deutlich zurück. Doch wir brauchen eben nicht nur Geld und Personal, um diese Stelle aufzubauen, sondern wir brauchen am Ende auch eine vertrauensvolle Kommunikation des Innenministeriums, damit die Menschen in großer Anzahl dieser Erkennung und Aufdeckung auch glauben.  Für uns ist klar: Die staatliche Exekutive, ob Bundesinnenministerium, Bürgermeister, Landräte, Ministerpräsidenten, braucht einen neuen Ansatz, über Krisen und Konflikte in diesem Land zu sprechen. Statt: „Wählt mich, ich kümmere mich drum; bleibt ganz unbesorgt“, muss es doch heißen: „Diese Krisen betreffen uns alle, und nur gemeinsam, solidarisch kommen wir durch diese Krisen durch.“ Und um das wirklich zu erreichen, brauchen wir eine solidarische und gerechtere Gesellschaft. Deswegen ist die Debatte um die Erbschaftsteuer so wichtig, ist die Debatte um Gerechtigkeit so wichtig; denn gute Krisenprävention beginnt damit, dass Gesellschaften gerecht aufgestellt sind.  Ich möchte einen konkreten Vorschlag einbringen. Wir haben den Warntag erlebt. Wir haben ein sehr gutes Warnsystem mit 97 Prozent Abdeckungsgrad. Lassen Sie uns diesen Warntag doch weiterentwickeln zu einem nationalen Übungstag, an dem eben nicht nur ein technisches System geprüft wird, sondern sich mal die Gemeinden angucken, ob die zivile Alarmplanung funktioniert, mal eine Probemeldung machen – das ist noch nie geübt worden –, an dem vor Ort in jeder Gemeinde eine Übung organisiert wird – Evakuierung, Erste Hilfe –, um die Menschen mitzunehmen und für diese Gefahren zu sensibilisieren.  Lassen Sie uns also diesen Tag stufenweise weiterentwickeln und ein bisschen mehr Verbindlichkeit, ein bisschen mehr Breitenwirkung erreichen als jetzt mit diesem zentralen Bevölkerungsschutztag, der meiner Meinung nach sein Ziel nicht ganz erreicht. Ich freue mich auf konstruktive Beratungen im Sinne der Einsatzkräfte und eines sicheren Landes. Vielen Dank.",SPEAKER_15,"Sehr geehrte Frau Präsidentin! Sehr geehrte Kolleginnen und Kollegen! Liebe Bürgerinnen und Bürger! Sehr geehrter Herr Bundesminister Dobrindt! Das 2022 beschlossene Sondervermögen für die Bundeswehr war notwendig und gleichzeitig zeigt eine Rückschau kurzsichtig. Denn es reduzierte die Bedrohung Russlands auf eine rein im Militärischen zu begegnende Gefahr.  Diese Kurzfristigkeit konnte 2025 mit der Bereichsausnahme für die zivile Verteidigung, die von uns Grünen eingebracht worden ist, behoben werden. Doch wir müssen kritisch sagen, damit haben wir im Bereich des Bundesinnenministeriums drei Jahre trotz proklamierter Zeitenwende weiter gesnust.  Maßgeblich für diese Kurzsichtigkeit war Herr Merz und die Union, die 2022 als Behandlungsbedingungen für das Sondervermögen formuliert hat, diese solle, Zitat, ausschließlich der Aufrüstung der Bundeswehr zugutekommen. Uns Grünen war bewusst, dass diese Bereichsausnahme und die damit einhergehende Mittelerhöhung nicht von uns selbst im Ministerium verwaltet wird. Dennoch haben wir diese Mittel ermöglicht, denn die Bedrohungslage für Deutschland ist hoch, so hoch, dass Handeln erforderlich ist.  Auch wenn dies jetzt jemand umsetzt, dessen Überzeugungen wir nicht in jedem Themenfeld der Innenpolitik teilen, haben wir doch aus Überzeugung dieser Bereichsausnahme zugestimmt.  Herr Dobrindt, dass Sie natürlich so monothematisch das Thema bearbeiten, wie jetzt auch in Ihrer Rede gezeigt und als Feigenblatt eigentlich nur am Anfang die Bedrohung einmal ansprechen, um nur über Migration zu sprechen, das hat uns vielleicht auch überrascht. Aber der Einzelplan des Bundesinnenministeriums 2026 bildet jetzt die Zeitenwende, die wir eigentlich schon 2022 vollzogen hätten müssen, im Zivilschutz ab.  Mit starken Aufwüchsen in allen Bereichen der zivilen Verteidigung ist die finanzielle Grundlage gelegt, die neue Sicherheitslage in Europa ergänzend zum Etat des Verteidigungsministeriums jetzt richtig aufzustellen. Das ist auch dringend notwendig.  In der Gesamtverteidigung nimmt das Bundesinnenministerium eine zentrale Rolle ein, und zwar, den Schutz der Bevölkerung an erster Stelle zu stellen und im Zweifelfall Ressourcenkonflikte, die zwischen militärischer Logik und Zivilschutzlogik entstehen, im Sinne der Bevölkerung und den Schutz der Bevölkerung vor Kriegsauswirkungen zu entscheiden. Wird diese Lücke nicht selbstbewusst wahrgenommen?  Dann verfehlt diese Aufgabenteilung zwischen Innenressort und Verteilungsressort seine Wirkung. Dann könnte man auch den Zivilschutz im militärischen Bereich anhängen, so wie das in vielen anderen europäischen Staaten ist. Doch jetzt, wo so viel Geld da ist,  braucht es nicht nur Mittel, sondern auch neue rechtliche Grundlagen, um wirklich effektiv die Bedrohungslage zu begehen. Die Drohnen wurden bereits angesprochen. Die Ausrüstung kann jetzt beschafft werden. Aber jetzt brauchen wir eben auch zügig die gesetzliche Grundlage, um diese Drohnenabwehr zu organisieren.  Während in Schweden über 100 Mitarbeiterinnen und Mitarbeiter sich um das Erkennen und Aufdecken ausländischer Desinformation kümmern, bleibt unsere zentrale Erkennungsstelle zur Erkennung ausländischer Informationsmanipulation deutlich zurück. Ja, so kompliziert, aber ein wichtiges Thema.  Aber wir brauchen eben nicht nur Geld und Personal, um diese Stelle aufzubauen, sondern wir brauchen am Ende auch eine vertrauensvolle Kommunikation des Innenministeriums, damit die Menschen in großer Anzahl dieser Erkennung und Aufdeckung auch glauben. Für uns ist klar, die staatliche Exekutive, ob Bundesinnenministerium, Bürgermeister, Landräter, Ministerpräsidenten, die brauchen eine neue Art, über Krisen und Konflikte in diesem Land zu sprechen, statt  Wählt mich! Ich kümmere mich darum! Bleibt ganz unbesorgt! Muss es doch heißen! Diese Krisen, die betreffen uns alle, und nur gemeinsam, solidarisch, kommen wir durch diese Krise durch. Um das wirklich zu erreichen, brauchen wir eine solidarische und gerechtere Gesellschaft. Deswegen ist die Debatte um die Erbschaftssteuer so wichtig, ist die Debatte um Gerechtigkeit so wichtig, weil gute Krisenprävention dort beginnt, wo Gesellschaften gerecht aufgestellt sind.  Ich möchte einen konkreten Vorschlag einbringen. Wir haben den Warentag erlebt. Wir haben ein sehr gutes Warnsystem mit 97 Prozent Abdeckungsgrad. Lassen Sie uns doch diesen Warentag zu einem nationalen Übungstag weiterentwickeln, wo eben nicht nur  – Zuruf des Abg. Dr. Bernd Baumann  Erste Hilfe, um die Menschen mitzunehmen und für diese Gefahren zu sensibilisieren. Lassen Sie uns dadurch stufenweise diesen Tag weiterentwickeln und ein bisschen mehr Verbindlichkeit, ein bisschen mehr Breitenwirkung erreichen als jetzt dieser zentrale Bevölkerungsschutztag, der meiner Meinung nach sein Ziel nicht ganz erfüllt. Ich freue mich auf konstruktive Beratung im Sinne der Einsatzkräfte und einem sicheren Land. Vielen Dank."
Präsidentin Julia Klöckner,Host,1.0000000000000004,1650.49,1657.08,Für die Fraktion Die Linke hat nun Herr Abgeordneter Dr. Dietmar Bartsch das Wort.,SPEAKER_12,Für die Fraktion Die Linke hat nun Herr Abgeordneter Dr. Dietmar Bartsch das Wort.
Dr. Dietmar Bartsch,Die Linke,0.9714776518228695,1657.1,1970.848,"Frau Präsidentin! Meine Damen und Herren! Lieber Minister Dobrindt, ich habe Ihrer Rede aufmerksam zugehört und will zwei Bemerkungen machen. Die erste als Appell: Sie sind Innenminister und nicht Migrationsminister.  Das heißt eben auch, Schwerpunkte auf andere Punkte als Migration zu setzen.  Zweitens will ich Ihnen etwas zu dem Satz mit dem Wettrüsten sagen. Ich will nicht die CDU von vor zehn Jahren zitieren, aber Wettrüsten bleibt nun mal eine schlechte Idee. Man muss das Gegenteil versuchen, sozusagen ein Gegenwettrüsten, und nicht immer mehr Mittel in die Aufrüstung stecken.  Wir haben eine große Gefahr, dass der soziale Zusammenhalt in unserem Land aufgekündigt wird. Herr Bundesminister, Ihr Etat steigt auf 15,4 Milliarden Euro. Das sind 160 Millionen mehr als im laufenden Jahr,  2,2 Milliarden Euro mehr als vor zwei Jahren. Das ist ganz anders als zum Beispiel bei den Mitteln für Krisenprävention und den Mitteln für Menschenrechte im Etat des Außenministers gestern. Das ist schon ein Widerspruch. Ich finde, darüber muss man mindestens – und das sollten auch Sie tun – nachdenken. Vor allen Dingen aber ist meine eindringliche Bitte: Bevor Sie über den angeblich zu teuren Sozialstaat fabulieren oder von Konsolidierung sprechen, fangen Sie in Ihrem eigenen Ministerium an, und das bitte an der richtigen Stelle.  Martin Gerster hat über Investitionen geredet; darauf will ich jetzt gar nicht weiter eingehen – vielleicht später. Sie sparen natürlich, aber Sie sparen aus meiner Sicht am falschen Ort. Ausgerechnet die Bundeszentrale für politische Bildung muss als einzige Behörde im Geschäftsbereich des BMI Kürzungen hinnehmen, die über Materialien und Veranstaltungen letztlich erwirtschaftet werden müssen. Gerade bei der politischen Bildung! Ist es denn wirklich so gut bestellt um die politische Bildung in unserem Land? Wohl kaum. Dann wird da noch ein neuer Schwerpunkt gesetzt, und der heißt: deutsche Verteidigungspolitik in einer erodierenden regelbasierten Weltordnung. „Zeitenwende“ hat das Olaf Scholz genannt, „Kriegstüchtigkeit“ hat das Boris Pistorius genannt. Nun findet dieses Denken sogar eine Verankerung in der politischen Bildung. Ich finde, das ist ein Problem, meine Damen und Herren. Ich halte das für deplatziert.  Meine Damen und Herren, eine Schwerpunktsetzung gibt es auch im Zivil- und Katastrophenschutz. Natürlich sagen auch wir, dass es richtig ist, dass beim THW die Mittel für Fahrzeuge, für Investitionen, für Liegenschaften usw. steigen; das fordert meine Fraktion seit Jahren. Doch die Begründung liegt nicht in den Folgen des Klimawandels und auch nicht in der wachsenden Gefahr durch Extremwetter, sondern in der Idee einer gesamtgesellschaftlichen Kriegstüchtigkeit; und das kritisieren wir, meine Damen und Herren. Eine Form von Krieg herrscht im Übrigen auch in Afghanistan. Sie haben jetzt darauf verwiesen, dass ja auch die Grünen damals die Taliban besucht haben. Ich finde, dass Sie eine De-facto-Anerkennung des Talibanregimes vornehmen, und das ist für mich eine moralische und auch eine politische Bankrotterklärung, meine Damen und Herren.  Kommen denn demnächst die Taliban zum Regierungsbesuch ins Kanzleramt? Werden die denn da auch mit militärischen Ehren empfangen? Es hilft überhaupt nicht, wenn Sie sagen: Die Grünen haben das auch gemacht. – Das ist für mich keine Entschuldigung. Ich finde, man darf dieses Talibanregime in keiner Weise aufwerten. Das sind wirklich Feudalstrukturen, die dort herrschen; die können wir in keiner Weise anerkennen.  Meine Damen und Herren, der Bundesinnenminister lobt in jeder Rede den Rückgang der Asylzahlen gegenüber dem Vorjahr. Er lobt sich damit natürlich auch selbst. Aber ich will mal deutlich sagen: Das sind natürlich alles Maßnahmen, die die Ampel zu verantworten hat. Denn ansonsten würden wir ja andere Zahlen haben. Das hat mit Ihrer Politik bisher sehr wenig zu tun. Wenn Sie dann noch von Humanität und Ordnung sprechen, ist wirklich für mich alles verloren. An der Migrationspolitik ist wenig human, und ordentlich ist sie schon gar nicht. Sie ist unehrlich, und zum Teil ist sie auch fahrlässig, meine Damen und Herren. Ich will nur ein Beispiel nennen: In den letzten Jahren haben wir sehr viele Fälle gescheiterter Integration erlebt. Trotzdem kürzen Sie im Kapitel „Integration und Migration“. Die Ausgaben für Sprachkurse sinken um 110 Millionen Euro. Das lässt sich auch nicht mit sinkenden Asylzahlen begründen. Wer im vergangenen Jahr vor Putins Raketen aus der Ukraine geflüchtet ist, der beginnt in diesem Jahr mit dem Sprachkurs, und er absolviert ihn im kommenden. Also da dürfen Sie überhaupt nicht streichen. Jeder weiß, ohne Sprache ist Integration unmöglich, und deswegen sind die Kürzungen hier unangemessen, meine Damen und Herren.  Ich will noch eine Bemerkung zur Polizei machen. Die Beamten loben Sie hier, und das tun Sie ja auch zu Recht. Aber es bleibt dabei, dass 6 000 Planstellen unbesetzt sind, während Sie neue Planstellen schaffen. Das ist weder seriös noch ehrlich. Das ist mindestens widersprüchlich. Ja, die Polizistinnen und Polizisten machen sehr wohl einen schweren Dienst. Ich finde aber, wie Sie mit der Zahl der Überstunden und anderem umgehen, bleibt inakzeptabel, meine Damen und Herren. Ich muss es leider abkürzen, will Ihnen aber klar sagen, dass der Haushalt des Bundesinnenministers nicht ehrlich ist. Er setzt die falschen Prioritäten. Er spart an den falschen Stellen. Meine Fraktion wird diesem Entwurf auf jeden Fall nicht zustimmen, aber ich hoffe, dass wir in den Beratungen an der einen oder anderen Stelle vielleicht noch Veränderungen vornehmen können. Herzlichen Dank.",SPEAKER_11,"Frau Präsidentin! Meine Damen und Herren! Lieber Minister Dobrindt, ich habe Ihrer Rede aufmerksam zugehört und will zwei Bemerkungen machen. Die erste ist als Appell. Sie sind Innenminister und nicht Migrationsminister. Es heißt Ihnen auch, wirklich Schwerpunkte auf andere Punkte als Migration zu setzen. Zweitens will ich Ihnen auch sagen,  Der Satz mit dem Wettrüsten. Ich will nicht die CDU von vor zehn Jahren zitieren, aber Wettrüsten bleibt nun mal eine schlechte Idee. Man muss das Gegenteil versuchen. Gegen Wettrüsten nicht immer mehr Mittel in die Aufrüstung, sondern wir haben eine große Gefahr, dass der soziale Zusammenhalt in unserem Land aufgekündigt wird.  Herr Bundesminister, Ihr Etat steigt auf 15,4 Milliarden Euro. Das sind 160 Millionen Euro mehr als im laufenden Jahr, 2,2 Milliarden Euro mehr als vor zwei Jahren. Das ist ganz anders als zum Beispiel bei den Mitteln für Krisenprävention und den Mitteln für Menschenrechte gestern der Etat des Außenministers. Das ist schon ein Widerspruch. Ich finde, da muss man mindestens und sollten auch Sie darüber nachdenken. Vor allen Dingen aber ist meine eindringliche Bitte,  Bevor Sie über den angeblich zu teuren Sozialstaat fabulieren oder von Konsolidierung da sprechen, fangen Sie in Ihrem eigenen Ministerium an, und das bitte an der richtigen Stelle. Martin Gasser hat über Investitionen geredet. Darauf will ich jetzt gar nicht weiter eingehen oder später. Aber Sie sparen natürlich, aber Sie sparen aus meiner Sicht am falschen Ort. Ausgerechnet die Bundeszentrale für politische Bildung als Einzelbehörde des BMI muss Kürzungen hinnehmen.  die über Materialien und Veranstaltungen letztlich erwirtschaftet werden müssen. Aber gerade bei der politischen Bildung ist es dann wirklich so gut bestellt um die politische Bildung in unserem Land? Wohl kaum. Dann wird noch ein neuer Schwerpunkt gesetzt, und der heißt deutsche Verteidigungspolitik in einer erodierenden, regelbasierten Weltordnung. Mein Zeitenwende hat das Olaf Scholz genannt, Kriegstüchtigkeit hat das Boris Pistorius genannt. Nun findet dieses Denken sogar eine Verankerung in der politischen Bildung. Ich finde, das ist ein Problem, meine Damen und Herren. Ich halte das für deplatziert.  – Zurufe von der AfD  liegt nicht in den Folgen des Klimawandels und auch nicht in der wachsenden Gefahr durch Extremwetter, sondern in der Idee einer gesamtgesellschaftlichen Kriegstüchtigkeit. Das kritisieren wir, meine Damen und Herren. Eine Form von Krieg herrscht im Übrigen auch in Afghanistan. Sie haben jetzt darauf verwiesen, dass die Grünen ja auch damals die Taliban besucht haben. Ich finde, dass Sie eine de facto Anerkennung des Taliban-Regimes vornehmen. Das ist für mich eine moralische und auch eine politische Bankrotterklärung, meine Damen und Herren.  Kommen demnächst die Taliban zum Regierungsbesuch und ins Kanzleramt? Werden die dann da auch mit militärischen Ehren empfangen? Das hilft überhaupt nicht, wenn Sie sagen, die Grünen haben das auch gemacht. Das ist für mich keine Entschuldigung. Ich finde, man darf dieses Taliban-Regime in keiner Weise aufwerten. Das sind wirklich Feudalstrukturen, die dort herrschen, und die können wir in keiner Weise anerkennen.  Meine Damen und Herren, der Bundesinnenminister lobt in jeder Rede den Rückgang der Asylzahlen gegenüber dem Vorjahr, und er lobt sich damit natürlich auch selbst. Aber ich will mal deutlich sagen, das sind natürlich alles Maßnahmen, die die Ampel zu verantworten hat. Denn ansonsten würden wir andere Zahlen haben. Das hat mit Ihrer Politik bisher sehr wenig zu tun. Wenn Sie dann noch von Humanität und Ordnung sprechen,  Da ist wirklich für mich alles verloren. An der Migrationspolitik ist wenig human, und ordentlich ist sie schon gar nicht. Sie ist unehrlich, und zum Teil ist sie auch fahrlässig, meine Damen und Herren. Ich will nur ein Beispiel sagen. In den letzten Jahren haben wir so viele Fälle gescheiterter  Integration erlebt. Trotzdem kürzen Sie im Kapitel Migration und Integration. Die Ausgaben für Sprachkurse sinken um 110 Millionen Euro, und das lässt sich auch nicht mit sinkenden Asylzahlen begründen. Wer im vergangenen Jahr vor Putins Raketen aus der Ukraine geflüchtet ist, der beginnt in diesem Jahr mit dem Sprachkurs und absolviert ihn im kommenden. Also, da dürfen Sie überhaupt nicht streichen. Jeder weiß, ohne Sprache ist Integration unmöglich, und deswegen sind die Kürzungen hier unangemessen, meine Damen und Herren.  Ich will noch eine Bemerkung zur Polizei machen. Die Beamten loben Sie hier, und das ist ja auch zu Recht. Aber es bleibt dabei und es soll sogar mehr geben, dass 6 000 Planstellen unbesetzt sind. Das ist weder seriös noch ehrlich. Das ist mindestens widersprüchlich. Ich finde, dass die  Polizistinnen und Polizisten ja, sehr wohl, einen schweren Dienst machen, aber die Zahl der Überstunden, wie sie damit umgehen, das alles bleibt inakzeptabel, meine Damen und Herren. Ich will das abkürzen. Ich muss es leider abkürzen. Ich will klar sagen, dass der Haushalt des Bundesinnenministers nicht ehrlich ist. Er setzt die falschen Prioritäten. Er spart an den falschen Stellen. Meine Fraktion wird diesem Entwurf auf jeden Fall nicht zustimmen. Aber ich hoffe auf die Beratung, dass wir an der einen oder anderen Stelle vielleicht noch Veränderungen vornehmen können. Herzlichen Dank."
Präsidentin Julia Klöckner,Host,0.755156958006045,1975.233,1980.18,Für die Fraktion der CDU/CSU hat Herr Abgeordneter Dr. Günter Krings das Wort.,SPEAKER_12,Für die Fraktion der CDU CSU hat der Abgeordnete Dr. Günther Krings das Wort.
